number,value,datetime_start,datetime_complete,duration,params_D,params_EXOG_ON,params_P,params_Q,params_d,params_enforce_invertibility,params_enforce_stationarity,params_m,params_p,params_q,params_trend,state
0,1.9999880646635892,2025-09-08 16:57:21.715680,2025-09-08 16:57:22.609680,0 days 00:00:00.894000,0,0,0,0,1,True,True,7,2,1,n,COMPLETE
1,0.22126042981580749,2025-09-08 16:57:21.717680,2025-09-08 16:57:38.819681,0 days 00:00:17.102001,0,1,0,0,0,True,True,7,3,5,c,COMPLETE
2,1.9975154195653582,2025-09-08 16:57:21.719680,2025-09-08 16:57:27.690680,0 days 00:00:05.971000,0,0,0,0,1,True,True,7,2,5,c,COMPLETE
3,1.9988672481381766,2025-09-08 16:57:21.720680,2025-09-08 16:57:29.655680,0 days 00:00:07.935000,0,0,0,0,2,True,True,7,2,5,c,COMPLETE
4,1.992438647955484,2025-09-08 16:57:21.723680,2025-09-08 16:57:29.657680,0 days 00:00:07.934000,0,0,0,0,2,True,True,7,4,3,c,COMPLETE
5,1.9999658032903878,2025-09-08 16:57:21.724680,2025-09-08 16:57:22.751680,0 days 00:00:01.027000,0,0,0,0,1,True,True,7,0,3,n,COMPLETE
6,1.9999131295750034,2025-09-08 16:57:21.727680,2025-09-08 16:57:23.179680,0 days 00:00:01.452000,0,0,0,0,2,True,True,7,1,1,n,COMPLETE
7,0.04105584024234711,2025-09-08 16:57:21.742680,2025-09-08 16:57:22.980680,0 days 00:00:01.238000,0,0,0,0,0,True,True,7,2,1,n,COMPLETE
8,0.041197956464242035,2025-09-08 16:57:21.753680,2025-09-08 16:57:29.319680,0 days 00:00:07.566000,0,0,0,0,0,True,True,7,5,3,c,COMPLETE
9,0.0405477417270787,2025-09-08 16:57:21.804679,2025-09-08 16:57:24.647682,0 days 00:00:02.843003,0,0,0,0,0,True,True,7,4,2,n,COMPLETE
10,1.9925589050121097,2025-09-08 16:57:21.840680,2025-09-08 16:57:38.799680,0 days 00:00:16.959000,0,1,0,0,1,True,True,7,5,3,c,COMPLETE
11,1.990495355760585,2025-09-08 16:57:21.881679,2025-09-08 16:57:30.995680,0 days 00:00:09.114001,0,0,0,0,2,True,True,7,3,4,c,COMPLETE
12,1.9946338295613575,2025-09-08 16:57:21.884679,2025-09-08 16:57:37.998681,0 days 00:00:16.114002,0,1,0,0,2,True,True,7,5,1,c,COMPLETE
13,1.999355447832577,2025-09-08 16:57:21.893679,2025-09-08 16:57:28.756680,0 days 00:00:06.863001,0,0,0,0,2,True,True,7,0,5,c,COMPLETE
14,1.9995261294338782,2025-09-08 16:57:21.896679,2025-09-08 16:57:24.577679,0 days 00:00:02.681000,0,0,0,0,1,True,True,7,5,2,n,COMPLETE
15,1.9990394657827038,2025-09-08 16:57:21.912679,2025-09-08 16:57:29.665680,0 days 00:00:07.753001,0,0,0,0,2,True,True,7,5,3,c,COMPLETE
16,0.4196737300418656,2025-09-08 16:57:21.929679,2025-09-08 16:57:25.907679,0 days 00:00:03.978000,0,1,0,0,0,True,True,7,2,5,n,COMPLETE
17,1.9924967891190706,2025-09-08 16:57:22.012679,2025-09-08 16:57:26.111679,0 days 00:00:04.099000,0,1,0,0,1,True,True,7,3,3,n,COMPLETE
18,1.999999235569846,2025-09-08 16:57:22.016679,2025-09-08 16:57:23.951680,0 days 00:00:01.935001,0,0,0,0,1,True,True,7,1,0,n,COMPLETE
19,1.9979143531755437,2025-09-08 16:57:22.130681,2025-09-08 16:57:25.411680,0 days 00:00:03.280999,0,0,0,0,2,True,True,7,5,0,c,COMPLETE
20,1.9993096816168936,2025-09-08 16:57:22.151680,2025-09-08 16:57:24.611683,0 days 00:00:02.460003,0,0,0,0,1,True,True,7,5,0,n,COMPLETE
21,1.999401969796179,2025-09-08 16:57:22.193680,2025-09-08 16:57:24.524679,0 days 00:00:02.330999,0,0,0,0,2,True,True,7,5,1,n,COMPLETE
22,1.9948775123830618,2025-09-08 16:57:22.207680,2025-09-08 16:57:25.691679,0 days 00:00:03.483999,0,1,0,0,2,True,True,7,0,2,n,COMPLETE
23,1.9990917670237023,2025-09-08 16:57:22.301681,2025-09-08 16:57:24.807679,0 days 00:00:02.505998,0,0,0,0,1,True,True,7,4,1,n,COMPLETE
24,1.992627332236508,2025-09-08 16:57:22.379681,2025-09-08 16:57:25.764679,0 days 00:00:03.384998,0,0,0,0,1,True,True,7,4,4,n,COMPLETE
25,1.9946782649091765,2025-09-08 16:57:22.396680,2025-09-08 16:57:37.606680,0 days 00:00:15.210000,0,1,0,0,2,True,True,7,3,1,c,COMPLETE
26,1.9911375970244667,2025-09-08 16:57:22.493680,2025-09-08 16:57:32.357681,0 days 00:00:09.864001,0,0,0,0,2,True,True,7,4,5,c,COMPLETE
27,1.9897779506779771,2025-09-08 16:57:22.577680,2025-09-08 16:57:26.663680,0 days 00:00:04.086000,0,1,0,0,2,True,True,7,3,5,n,COMPLETE
28,0.04556771590884897,2025-09-08 16:57:22.605681,2025-09-08 16:57:26.045679,0 days 00:00:03.439998,0,0,0,0,0,True,True,7,1,3,c,COMPLETE
29,0.04142829653685002,2025-09-08 16:57:22.677680,2025-09-08 16:57:25.052679,0 days 00:00:02.374999,0,0,0,0,0,True,True,7,4,0,n,COMPLETE
30,1.9978244741117628,2025-09-08 16:57:22.706680,2025-09-08 16:57:25.946681,0 days 00:00:03.240001,0,0,0,0,2,True,True,7,4,0,c,COMPLETE
31,1.990495355760585,2025-09-08 16:57:22.840681,2025-09-08 16:57:31.024680,0 days 00:00:08.183999,0,0,0,0,2,True,True,7,3,4,c,COMPLETE
32,0.19729619273816432,2025-09-08 16:57:25.513692,2025-09-08 16:57:27.414680,0 days 00:00:01.900988,0,1,0,0,0,True,True,7,2,2,n,COMPLETE
33,0.2068532136921497,2025-09-08 16:57:26.101680,2025-09-08 16:57:27.637679,0 days 00:00:01.535999,0,1,0,0,0,True,True,7,2,1,n,COMPLETE
34,0.04040276276171314,2025-09-08 16:57:26.540680,2025-09-08 16:57:27.641679,0 days 00:00:01.100999,0,0,0,0,0,True,True,7,3,2,n,COMPLETE
35,0.054588620589147735,2025-09-08 16:57:27.357680,2025-09-08 16:57:35.916679,0 days 00:00:08.558999,0,0,0,0,0,True,True,7,4,2,c,COMPLETE
36,0.04115346195848241,2025-09-08 16:57:28.254680,2025-09-08 16:57:35.667680,0 days 00:00:07.413000,0,0,0,0,0,True,True,7,4,3,c,COMPLETE
37,0.04115346195848241,2025-09-08 16:57:28.538679,2025-09-08 16:57:36.015680,0 days 00:00:07.477001,0,0,0,0,0,True,True,7,4,3,c,COMPLETE
38,0.054588620589147735,2025-09-08 16:57:28.765680,2025-09-08 16:57:36.270679,0 days 00:00:07.504999,0,0,0,0,0,True,True,7,4,2,c,COMPLETE
39,0.04040276276171314,2025-09-08 16:57:28.879679,2025-09-08 16:57:29.104680,0 days 00:00:00.225001,0,0,0,0,0,True,True,7,3,2,n,COMPLETE
40,0.0405477417270787,2025-09-08 16:57:29.419680,2025-09-08 16:57:29.567680,0 days 00:00:00.148000,0,0,0,0,0,True,True,7,4,2,n,COMPLETE
41,0.04128191276632094,2025-09-08 16:57:29.594680,2025-09-08 16:57:31.806680,0 days 00:00:02.212000,0,0,0,0,0,True,True,7,2,3,n,COMPLETE
42,0.04128191276632094,2025-09-08 16:57:29.652680,2025-09-08 16:57:31.757680,0 days 00:00:02.105000,0,0,0,0,0,True,True,7,2,3,n,COMPLETE
43,0.04509831615652992,2025-09-08 16:57:29.757679,2025-09-08 16:57:33.168681,0 days 00:00:03.411002,0,0,0,0,0,True,True,7,3,1,c,COMPLETE
44,0.04128191276632094,2025-09-08 16:57:29.900681,2025-09-08 16:57:32.108680,0 days 00:00:02.207999,0,0,0,0,0,True,True,7,2,3,n,COMPLETE
45,0.0420908726608708,2025-09-08 16:57:30.245680,2025-09-08 16:57:32.922680,0 days 00:00:02.677000,0,0,0,0,0,True,True,7,2,4,n,COMPLETE
46,0.0404835281535303,2025-09-08 16:57:31.307681,2025-09-08 16:57:33.002680,0 days 00:00:01.694999,0,0,0,0,0,True,True,7,3,3,n,COMPLETE
47,0.0404835281535303,2025-09-08 16:57:31.734680,2025-09-08 16:57:33.370679,0 days 00:00:01.635999,0,0,0,0,0,True,True,7,3,3,n,COMPLETE
48,0.0405477417270787,2025-09-08 16:57:31.866681,2025-09-08 16:57:32.257682,0 days 00:00:00.391001,0,0,0,0,0,True,True,7,4,2,n,COMPLETE
49,0.0405477417270787,2025-09-08 16:57:31.885680,2025-09-08 16:57:32.648680,0 days 00:00:00.763000,0,0,0,0,0,True,True,7,4,2,n,COMPLETE
50,0.04074834677782263,2025-09-08 16:57:33.081680,2025-09-08 16:57:35.273683,0 days 00:00:02.192003,0,0,0,0,0,True,True,7,5,4,n,COMPLETE
51,0.198878429574837,2025-09-08 16:57:33.210683,2025-09-08 16:57:36.114681,0 days 00:00:02.903998,0,1,0,0,0,True,True,7,5,3,n,COMPLETE
52,0.3638425622490123,2025-09-08 16:57:33.317680,2025-09-08 16:57:37.777681,0 days 00:00:04.460001,0,1,0,0,0,True,True,7,4,2,c,COMPLETE
53,0.04103076065825577,2025-09-08 16:57:33.379681,2025-09-08 16:57:35.917679,0 days 00:00:02.537998,0,0,0,0,0,True,True,7,4,4,n,COMPLETE
54,0.04103076065825577,2025-09-08 16:57:34.139685,2025-09-08 16:57:36.068680,0 days 00:00:01.928995,0,0,0,0,0,True,True,7,4,4,n,COMPLETE
55,0.04040276276171314,2025-09-08 16:57:36.140679,2025-09-08 16:57:36.248679,0 days 00:00:00.108000,0,0,0,0,0,True,True,7,3,2,n,COMPLETE
56,0.04040276276171314,2025-09-08 16:57:36.226679,2025-09-08 16:57:36.355679,0 days 00:00:00.129000,0,0,0,0,0,True,True,7,3,2,n,COMPLETE
57,0.04040276276171314,2025-09-08 16:57:36.237679,2025-09-08 16:57:36.337679,0 days 00:00:00.100000,0,0,0,0,0,True,True,7,3,2,n,COMPLETE
58,1.9963555318545776,2025-09-08 16:57:36.392679,2025-09-08 16:57:36.925680,0 days 00:00:00.533001,0,0,0,0,1,True,True,7,2,2,n,COMPLETE
59,0.04103628195770933,2025-09-08 16:57:36.657682,2025-09-08 16:57:37.500681,0 days 00:00:00.842999,0,0,0,0,0,True,True,7,3,1,n,COMPLETE
60,0.04105584024234711,2025-09-08 16:57:36.897680,2025-09-08 16:57:37.148680,0 days 00:00:00.251000,0,0,0,0,0,True,True,7,2,1,n,COMPLETE
61,0.04103628195770933,2025-09-08 16:57:37.143680,2025-09-08 16:57:37.633682,0 days 00:00:00.490002,0,0,0,0,0,True,True,7,3,1,n,COMPLETE
62,0.04040276276171314,2025-09-08 16:57:37.522682,2025-09-08 16:57:37.601681,0 days 00:00:00.078999,0,0,0,0,0,True,True,7,3,2,n,COMPLETE
63,0.04040276276171314,2025-09-08 16:57:37.559685,2025-09-08 16:57:37.642683,0 days 00:00:00.082998,0,0,0,0,0,True,True,7,3,2,n,COMPLETE
64,0.04040276276171314,2025-09-08 16:57:37.637680,2025-09-08 16:57:37.701680,0 days 00:00:00.064000,0,0,0,0,0,True,True,7,3,2,n,COMPLETE
65,0.5713679303743981,2025-09-08 16:57:37.660681,2025-09-08 16:57:38.122681,0 days 00:00:00.462000,0,1,0,0,0,True,True,7,4,0,n,COMPLETE
66,1.993777786291002,2025-09-08 16:57:37.735681,2025-09-08 16:57:38.124680,0 days 00:00:00.388999,0,1,0,0,1,True,True,7,1,0,c,COMPLETE
67,1.9946628358485279,2025-09-08 16:57:37.793683,2025-09-08 16:57:43.895679,0 days 00:00:06.101996,0,1,0,0,2,True,True,7,1,4,c,COMPLETE
68,0.04040276276171314,2025-09-08 16:57:37.891681,2025-09-08 16:57:38.026680,0 days 00:00:00.134999,0,0,0,0,0,True,True,7,3,2,n,COMPLETE
69,0.04040276276171314,2025-09-08 16:57:37.906681,2025-09-08 16:57:37.993680,0 days 00:00:00.086999,0,0,0,0,0,True,True,7,3,2,n,COMPLETE
70,0.5488169149384101,2025-09-08 16:57:38.059680,2025-09-08 16:57:42.087681,0 days 00:00:04.028001,0,1,0,0,0,True,True,7,2,3,c,COMPLETE
71,0.20393995596325634,2025-09-08 16:57:38.106680,2025-09-08 16:57:39.100680,0 days 00:00:00.994000,0,1,0,0,0,True,True,7,4,1,n,COMPLETE
72,1.9950943429540182,2025-09-08 16:57:38.147681,2025-09-08 16:57:40.237680,0 days 00:00:02.089999,0,1,0,0,2,True,True,7,5,3,n,COMPLETE
73,1.9936085257097746,2025-09-08 16:57:38.190681,2025-09-08 16:57:39.075681,0 days 00:00:00.885000,0,0,0,0,1,True,True,7,3,2,n,COMPLETE
74,0.5689940235489086,2025-09-08 16:57:38.973681,2025-09-08 16:57:40.848682,0 days 00:00:01.875001,0,1,0,0,0,True,True,7,3,3,n,COMPLETE
75,1.9936085257097746,2025-09-08 16:57:39.056680,2025-09-08 16:57:39.254681,0 days 00:00:00.198001,0,0,0,0,1,True,True,7,3,2,n,COMPLETE
76,0.04040276276171314,2025-09-08 16:57:39.106680,2025-09-08 16:57:39.216680,0 days 00:00:00.110000,0,0,0,0,0,True,True,7,3,2,n,COMPLETE
77,0.04103628195770933,2025-09-08 16:57:39.124680,2025-09-08 16:57:39.355681,0 days 00:00:00.231001,0,0,0,0,0,True,True,7,3,1,n,COMPLETE
78,1.9995295077526285,2025-09-08 16:57:39.470681,2025-09-08 16:57:40.132679,0 days 00:00:00.661998,0,0,0,0,2,True,True,7,0,1,c,COMPLETE
79,1.9953100137429394,2025-09-08 16:57:39.664682,2025-09-08 16:57:41.803681,0 days 00:00:02.138999,0,0,0,0,1,True,True,7,2,2,c,COMPLETE
80,0.041040701042565,2025-09-08 16:57:39.831680,2025-09-08 16:57:40.708681,0 days 00:00:00.877001,0,0,0,0,0,True,True,7,2,2,n,COMPLETE
81,1.9945336304903087,2025-09-08 16:57:39.959681,2025-09-08 16:57:42.044680,0 days 00:00:02.084999,0,1,0,0,1,True,True,7,0,5,c,COMPLETE
82,0.041040701042565,2025-09-08 16:57:40.010680,2025-09-08 16:57:40.726682,0 days 00:00:00.716002,0,0,0,0,0,True,True,7,2,2,n,COMPLETE
83,0.5689940235489086,2025-09-08 16:57:40.651680,2025-09-08 16:57:42.443680,0 days 00:00:01.792000,0,1,0,0,0,True,True,7,3,3,n,COMPLETE
84,0.04040276276171314,2025-09-08 16:57:40.755679,2025-09-08 16:57:40.938681,0 days 00:00:00.183002,0,0,0,0,0,True,True,7,3,2,n,COMPLETE
85,1.9952993987161607,2025-09-08 16:57:40.960683,2025-09-08 16:57:41.462679,0 days 00:00:00.501996,0,0,0,0,1,True,True,7,2,1,c,COMPLETE
86,0.04040276276171314,2025-09-08 16:57:41.408682,2025-09-08 16:57:41.547681,0 days 00:00:00.138999,0,0,0,0,0,True,True,7,3,2,n,COMPLETE
87,0.04040276276171314,2025-09-08 16:57:41.533680,2025-09-08 16:57:41.812680,0 days 00:00:00.279000,0,0,0,0,0,True,True,7,3,2,n,COMPLETE
88,0.04040276276171314,2025-09-08 16:57:41.537680,2025-09-08 16:57:41.810682,0 days 00:00:00.273002,0,0,0,0,0,True,True,7,3,2,n,COMPLETE
89,0.5492733599791837,2025-09-08 16:57:41.550681,2025-09-08 16:57:44.016682,0 days 00:00:02.466001,0,1,0,0,0,True,True,7,1,3,c,COMPLETE
90,0.04040276276171314,2025-09-08 16:57:41.671681,2025-09-08 16:57:41.854683,0 days 00:00:00.183002,0,0,0,0,0,True,True,7,3,2,n,COMPLETE
91,0.04040276276171314,2025-09-08 16:57:41.956680,2025-09-08 16:57:42.240680,0 days 00:00:00.284000,0,0,0,0,0,True,True,7,3,2,n,COMPLETE
92,0.04040276276171314,2025-09-08 16:57:41.978681,2025-09-08 16:57:42.117680,0 days 00:00:00.138999,0,0,0,0,0,True,True,7,3,2,n,COMPLETE
93,1.9945764553195824,2025-09-08 16:57:42.117680,2025-09-08 16:57:47.066680,0 days 00:00:04.949000,0,1,0,0,2,True,True,7,1,3,c,COMPLETE
94,0.04473066255085246,2025-09-08 16:57:42.271680,2025-09-08 16:57:43.664680,0 days 00:00:01.393000,0,0,0,0,0,True,True,7,2,3,c,COMPLETE
95,0.04533232032013432,2025-09-08 16:57:42.356681,2025-09-08 16:57:43.150680,0 days 00:00:00.793999,0,0,0,0,0,True,True,7,2,2,c,COMPLETE
96,0.0405477417270787,2025-09-08 16:57:42.492680,2025-09-08 16:57:42.612680,0 days 00:00:00.120000,0,0,0,0,0,True,True,7,4,2,n,COMPLETE
97,0.0405477417270787,2025-09-08 16:57:42.531682,2025-09-08 16:57:42.698680,0 days 00:00:00.166998,0,0,0,0,0,True,True,7,4,2,n,COMPLETE
98,0.04040276276171314,2025-09-08 16:57:42.639679,2025-09-08 16:57:42.815681,0 days 00:00:00.176002,0,0,0,0,0,True,True,7,3,2,n,COMPLETE
99,1.9926240476706214,2025-09-08 16:57:42.928680,2025-09-08 16:57:46.710683,0 days 00:00:03.782003,0,1,0,0,2,True,True,7,2,3,c,COMPLETE
100,0.0404835281535303,2025-09-08 16:57:43.018681,2025-09-08 16:57:43.179679,0 days 00:00:00.160998,0,0,0,0,0,True,True,7,3,3,n,COMPLETE
101,0.041040701042565,2025-09-08 16:57:43.201679,2025-09-08 16:57:43.345680,0 days 00:00:00.144001,0,0,0,0,0,True,True,7,2,2,n,COMPLETE
102,0.041040701042565,2025-09-08 16:57:43.324680,2025-09-08 16:57:43.464680,0 days 00:00:00.140000,0,0,0,0,0,True,True,7,2,2,n,COMPLETE
103,0.04040276276171314,2025-09-08 16:57:43.405681,2025-09-08 16:57:43.533680,0 days 00:00:00.127999,0,0,0,0,0,True,True,7,3,2,n,COMPLETE
104,0.04103628195770933,2025-09-08 16:57:43.475681,2025-09-08 16:57:43.584680,0 days 00:00:00.108999,0,0,0,0,0,True,True,7,3,1,n,COMPLETE
105,0.04103628195770933,2025-09-08 16:57:43.508681,2025-09-08 16:57:43.634681,0 days 00:00:00.126000,0,0,0,0,0,True,True,7,3,1,n,COMPLETE
106,0.6143179746662512,2025-09-08 16:57:43.680679,2025-09-08 16:57:43.958680,0 days 00:00:00.278001,0,1,0,0,0,True,True,7,0,0,n,COMPLETE
107,0.0404835281535303,2025-09-08 16:57:43.700679,2025-09-08 16:57:43.812680,0 days 00:00:00.112001,0,0,0,0,0,True,True,7,3,3,n,COMPLETE
108,0.04040276276171314,2025-09-08 16:57:43.846680,2025-09-08 16:57:43.965680,0 days 00:00:00.119000,0,0,0,0,0,True,True,7,3,2,n,COMPLETE
109,0.0404835281535303,2025-09-08 16:57:43.920680,2025-09-08 16:57:44.001681,0 days 00:00:00.081001,0,0,0,0,0,True,True,7,3,3,n,COMPLETE
110,1.9928746465927702,2025-09-08 16:57:44.011681,2025-09-08 16:57:45.147681,0 days 00:00:01.136000,0,1,0,0,1,True,True,7,5,0,c,COMPLETE
111,0.0405477417270787,2025-09-08 16:57:44.049680,2025-09-08 16:57:44.103681,0 days 00:00:00.054001,0,0,0,0,0,True,True,7,4,2,n,COMPLETE
112,1.9945547165380872,2025-09-08 16:57:44.168680,2025-09-08 16:57:44.808680,0 days 00:00:00.640000,0,1,0,0,2,True,True,7,2,0,n,COMPLETE
113,1.9932614587062563,2025-09-08 16:57:44.270681,2025-09-08 16:57:44.840680,0 days 00:00:00.569999,0,0,0,0,1,True,True,7,3,3,n,COMPLETE
114,0.04040276276171314,2025-09-08 16:57:44.381680,2025-09-08 16:57:44.787681,0 days 00:00:00.406001,0,0,0,0,0,True,True,7,3,2,n,COMPLETE
115,1.9932614587062563,2025-09-08 16:57:44.728679,2025-09-08 16:57:45.395680,0 days 00:00:00.667001,0,0,0,0,1,True,True,7,3,3,n,COMPLETE
116,1.9932614587062563,2025-09-08 16:57:44.752679,2025-09-08 16:57:44.856681,0 days 00:00:00.104002,0,0,0,0,1,True,True,7,3,3,n,COMPLETE
117,1.9932614587062563,2025-09-08 16:57:44.762679,2025-09-08 16:57:44.888684,0 days 00:00:00.126005,0,0,0,0,1,True,True,7,3,3,n,COMPLETE
118,1.9993551106163165,2025-09-08 16:57:44.804680,2025-09-08 16:57:45.550681,0 days 00:00:00.746001,0,0,0,0,1,True,True,7,4,3,n,COMPLETE
119,0.04040276276171314,2025-09-08 16:57:44.848680,2025-09-08 16:57:45.371681,0 days 00:00:00.523001,0,0,0,0,0,True,True,7,3,2,n,COMPLETE
120,1.9999140650744958,2025-09-08 16:57:45.346681,2025-09-08 16:57:45.668681,0 days 00:00:00.322000,0,0,0,0,2,True,True,7,0,3,n,COMPLETE
121,0.04040276276171314,2025-09-08 16:57:45.418679,2025-09-08 16:57:45.584681,0 days 00:00:00.166002,0,0,0,0,0,True,True,7,3,2,n,COMPLETE
122,1.9999790350829072,2025-09-08 16:57:45.566680,2025-09-08 16:57:45.765682,0 days 00:00:00.199002,0,0,0,0,1,True,True,7,3,1,n,COMPLETE
123,1.9999775646624458,2025-09-08 16:57:45.662681,2025-09-08 16:57:45.908680,0 days 00:00:00.245999,0,0,0,0,1,True,True,7,3,0,n,COMPLETE
124,1.9900651057211542,2025-09-08 16:57:45.681681,2025-09-08 16:57:51.206680,0 days 00:00:05.524999,0,1,0,0,1,True,True,7,4,5,c,PRUNED
125,1.9929971927228427,2025-09-08 16:57:45.713682,2025-09-08 16:57:46.682679,0 days 00:00:00.968997,0,1,0,0,1,True,True,7,3,2,n,COMPLETE
126,0.04040276276171314,2025-09-08 16:57:45.911681,2025-09-08 16:57:46.142681,0 days 00:00:00.231000,0,0,0,0,0,True,True,7,3,2,n,COMPLETE
127,0.04040276276171314,2025-09-08 16:57:46.290679,2025-09-08 16:57:46.393681,0 days 00:00:00.103002,0,0,0,0,0,True,True,7,3,2,n,COMPLETE
128,0.20261412835044912,2025-09-08 16:57:46.401681,2025-09-08 16:57:47.208680,0 days 00:00:00.806999,0,1,0,0,0,True,True,7,3,2,n,COMPLETE
129,0.041240674139601294,2025-09-08 16:57:46.412680,2025-09-08 16:57:47.110682,0 days 00:00:00.698002,0,0,0,0,0,True,True,7,4,1,n,COMPLETE
130,0.041240674139601294,2025-09-08 16:57:46.469681,2025-09-08 16:57:47.179682,0 days 00:00:00.710001,0,0,0,0,0,True,True,7,4,1,n,COMPLETE
131,0.041240674139601294,2025-09-08 16:57:46.674680,2025-09-08 16:57:47.111682,0 days 00:00:00.437002,0,0,0,0,0,True,True,7,4,1,n,COMPLETE
132,0.041240674139601294,2025-09-08 16:57:46.700680,2025-09-08 16:57:47.120680,0 days 00:00:00.420000,0,0,0,0,0,True,True,7,4,1,n,COMPLETE
133,0.041240674139601294,2025-09-08 16:57:46.896681,2025-09-08 16:57:47.177681,0 days 00:00:00.281000,0,0,0,0,0,True,True,7,4,1,n,COMPLETE
134,0.04105584024234711,2025-09-08 16:57:47.103679,2025-09-08 16:57:47.185680,0 days 00:00:00.082001,0,0,0,0,0,True,True,7,2,1,n,COMPLETE
135,0.04105584024234711,2025-09-08 16:57:47.175680,2025-09-08 16:57:47.220683,0 days 00:00:00.045003,0,0,0,0,0,True,True,7,2,1,n,COMPLETE
136,0.04040276276171314,2025-09-08 16:57:47.213680,2025-09-08 16:57:47.246684,0 days 00:00:00.033004,0,0,0,0,0,True,True,7,3,2,n,COMPLETE
137,0.04040276276171314,2025-09-08 16:57:47.225680,2025-09-08 16:57:47.282681,0 days 00:00:00.057001,0,0,0,0,0,True,True,7,3,2,n,COMPLETE
138,0.04040276276171314,2025-09-08 16:57:47.251681,2025-09-08 16:57:47.309679,0 days 00:00:00.057998,0,0,0,0,0,True,True,7,3,2,n,COMPLETE
139,0.0404835281535303,2025-09-08 16:57:47.285682,2025-09-08 16:57:47.337680,0 days 00:00:00.051998,0,0,0,0,0,True,True,7,3,3,n,COMPLETE
140,0.04163888491419558,2025-09-08 16:57:47.308681,2025-09-08 16:57:47.776679,0 days 00:00:00.467998,0,0,0,0,0,True,True,7,4,3,n,COMPLETE
141,1.9974955316530612,2025-09-08 16:57:47.702679,2025-09-08 16:57:47.978683,0 days 00:00:00.276004,0,1,0,0,1,True,True,7,0,3,n,COMPLETE
142,0.041040701042565,2025-09-08 16:57:47.751679,2025-09-08 16:57:47.848682,0 days 00:00:00.097003,0,0,0,0,0,True,True,7,2,2,n,COMPLETE
143,0.041040701042565,2025-09-08 16:57:47.789680,2025-09-08 16:57:47.876680,0 days 00:00:00.087000,0,0,0,0,0,True,True,7,2,2,n,COMPLETE
144,0.04040276276171314,2025-09-08 16:57:47.853680,2025-09-08 16:57:47.918681,0 days 00:00:00.065001,0,0,0,0,0,True,True,7,3,2,n,COMPLETE
145,0.04040276276171314,2025-09-08 16:57:47.867679,2025-09-08 16:57:47.954680,0 days 00:00:00.087001,0,0,0,0,0,True,True,7,3,2,n,COMPLETE
146,0.04040276276171314,2025-09-08 16:57:47.888682,2025-09-08 16:57:47.942681,0 days 00:00:00.053999,0,0,0,0,0,True,True,7,3,2,n,COMPLETE
147,0.04040276276171314,2025-09-08 16:57:47.937680,2025-09-08 16:57:47.989680,0 days 00:00:00.052000,0,0,0,0,0,True,True,7,3,2,n,COMPLETE
148,0.04040276276171314,2025-09-08 16:57:47.952680,2025-09-08 16:57:48.011680,0 days 00:00:00.059000,0,0,0,0,0,True,True,7,3,2,n,COMPLETE
149,1.992144135700487,2025-09-08 16:57:47.984681,2025-09-08 16:57:49.220679,0 days 00:00:01.235998,0,0,0,0,1,True,True,7,4,2,c,COMPLETE
150,0.5625025255216539,2025-09-08 16:57:48.003679,2025-09-08 16:57:49.087679,0 days 00:00:01.084000,0,1,0,0,0,True,True,7,0,5,n,COMPLETE
151,0.04040276276171314,2025-09-08 16:57:48.034680,2025-09-08 16:57:48.138679,0 days 00:00:00.103999,0,0,0,0,0,True,True,7,3,2,n,COMPLETE
152,0.0404835281535303,2025-09-08 16:57:48.210682,2025-09-08 16:57:48.492681,0 days 00:00:00.281999,0,0,0,0,0,True,True,7,3,3,n,COMPLETE
153,0.04040276276171314,2025-09-08 16:57:48.528681,2025-09-08 16:57:48.680681,0 days 00:00:00.152000,0,0,0,0,0,True,True,7,3,2,n,COMPLETE
154,0.04040276276171314,2025-09-08 16:57:48.700680,2025-09-08 16:57:48.981679,0 days 00:00:00.280999,0,0,0,0,0,True,True,7,3,2,n,COMPLETE
155,0.04040276276171314,2025-09-08 16:57:48.993679,2025-09-08 16:57:49.042680,0 days 00:00:00.049001,0,0,0,0,0,True,True,7,3,2,n,COMPLETE
156,0.05777959891109575,2025-09-08 16:57:49.033680,2025-09-08 16:57:51.224680,0 days 00:00:02.191000,0,0,0,0,0,True,True,7,3,2,c,PRUNED
