number,value,datetime_start,datetime_complete,duration,params_D,params_EXOG_ON,params_P,params_Q,params_d,params_enforce_invertibility,params_enforce_stationarity,params_m,params_p,params_q,params_trend,state
955,0.04103628195770933,2025-09-08 16:58:24.211681,2025-09-08 16:58:24.312682,0 days 00:00:00.101001,0,0,0,0,0,True,True,7,3,1,n,PRUNED
956,0.04103628195770933,2025-09-08 16:58:24.220680,2025-09-08 16:58:24.332682,0 days 00:00:00.112002,0,0,0,0,0,True,True,7,3,1,n,PRUNED
957,0.04103628195770933,2025-09-08 16:58:24.229680,2025-09-08 16:58:24.342682,0 days 00:00:00.113002,0,0,0,0,0,True,True,7,3,1,n,PRUNED
958,0.04103628195770933,2025-09-08 16:58:24.240681,2025-09-08 16:58:24.348680,0 days 00:00:00.107999,0,0,0,0,0,True,True,7,3,1,n,PRUNED
959,0.04103628195770933,2025-09-08 16:58:24.248680,2025-09-08 16:58:24.359680,0 days 00:00:00.111000,0,0,0,0,0,True,True,7,3,1,n,PRUNED
960,0.04103628195770933,2025-09-08 16:58:24.264684,2025-09-08 16:58:24.387681,0 days 00:00:00.122997,0,0,0,0,0,True,True,7,3,1,n,PRUNED
961,0.04105584024234711,2025-09-08 16:58:24.275681,2025-09-08 16:58:24.385680,0 days 00:00:00.109999,0,0,0,0,0,True,True,7,2,1,n,PRUNED
962,0.04103628195770933,2025-09-08 16:58:24.284682,2025-09-08 16:58:24.388680,0 days 00:00:00.103998,0,0,0,0,0,True,True,7,3,1,n,PRUNED
963,0.04103628195770933,2025-09-08 16:58:24.287681,2025-09-08 16:58:24.392681,0 days 00:00:00.105000,0,0,0,0,0,True,True,7,3,1,n,PRUNED
964,0.04103628195770933,2025-09-08 16:58:24.301681,2025-09-08 16:58:24.404680,0 days 00:00:00.102999,0,0,0,0,0,True,True,7,3,1,n,PRUNED
965,0.04105584024234711,2025-09-08 16:58:24.318684,2025-09-08 16:58:24.400680,0 days 00:00:00.081996,0,0,0,0,0,True,True,7,2,1,n,PRUNED
966,0.041040701042565,2025-09-08 16:58:24.343680,2025-09-08 16:58:24.428681,0 days 00:00:00.085001,0,0,0,0,0,True,True,7,2,2,n,PRUNED
967,0.04040276276171314,2025-09-08 16:58:24.349680,2025-09-08 16:58:24.450684,0 days 00:00:00.101004,0,0,0,0,0,True,True,7,3,2,n,COMPLETE
968,0.041040701042565,2025-09-08 16:58:24.363680,2025-09-08 16:58:24.447681,0 days 00:00:00.084001,0,0,0,0,0,True,True,7,2,2,n,PRUNED
969,0.041040701042565,2025-09-08 16:58:24.374681,2025-09-08 16:58:24.460681,0 days 00:00:00.086000,0,0,0,0,0,True,True,7,2,2,n,PRUNED
970,0.0405477417270787,2025-09-08 16:58:24.393680,2025-09-08 16:58:24.464684,0 days 00:00:00.071004,0,0,0,0,0,True,True,7,4,2,n,PRUNED
971,0.0405477417270787,2025-09-08 16:58:24.408680,2025-09-08 16:58:24.474681,0 days 00:00:00.066001,0,0,0,0,0,True,True,7,4,2,n,PRUNED
972,0.0405477417270787,2025-09-08 16:58:24.415680,2025-09-08 16:58:24.483681,0 days 00:00:00.068001,0,0,0,0,0,True,True,7,4,2,n,PRUNED
973,0.0405477417270787,2025-09-08 16:58:24.436680,2025-09-08 16:58:24.496680,0 days 00:00:00.060000,0,0,0,0,0,True,True,7,4,2,n,PRUNED
974,0.0405477417270787,2025-09-08 16:58:24.452681,2025-09-08 16:58:24.502680,0 days 00:00:00.049999,0,0,0,0,0,True,True,7,4,2,n,PRUNED
975,0.0405477417270787,2025-09-08 16:58:24.466680,2025-09-08 16:58:24.505681,0 days 00:00:00.039001,0,0,0,0,0,True,True,7,4,2,n,PRUNED
976,0.04040276276171314,2025-09-08 16:58:24.476682,2025-09-08 16:58:24.509681,0 days 00:00:00.032999,0,0,0,0,0,True,True,7,3,2,n,COMPLETE
977,1.9918689946472987,2025-09-08 16:58:24.515681,2025-09-08 16:58:25.857680,0 days 00:00:01.341999,0,1,0,0,1,True,True,7,5,4,c,PRUNED
978,0.0404835281535303,2025-09-08 16:58:24.523680,2025-09-08 16:58:24.573680,0 days 00:00:00.050000,0,0,0,0,0,True,True,7,3,3,n,PRUNED
979,0.0404835281535303,2025-09-08 16:58:24.537680,2025-09-08 16:58:24.630684,0 days 00:00:00.093004,0,0,0,0,0,True,True,7,3,3,n,PRUNED
980,0.0404835281535303,2025-09-08 16:58:24.545681,2025-09-08 16:58:24.623682,0 days 00:00:00.078001,0,0,0,0,0,True,True,7,3,3,n,PRUNED
981,0.05777959891109575,2025-09-08 16:58:24.553680,2025-09-08 16:58:24.651680,0 days 00:00:00.098000,0,0,0,0,0,True,True,7,3,2,c,PRUNED
982,1.9925589050121097,2025-09-08 16:58:24.586681,2025-09-08 16:58:24.723680,0 days 00:00:00.136999,0,1,0,0,1,True,True,7,5,3,c,PRUNED
983,0.04040276276171314,2025-09-08 16:58:24.594681,2025-09-08 16:58:24.744681,0 days 00:00:00.150000,0,0,0,0,0,True,True,7,3,2,n,COMPLETE
984,0.04040276276171314,2025-09-08 16:58:24.638680,2025-09-08 16:58:24.780680,0 days 00:00:00.142000,0,0,0,0,0,True,True,7,3,2,n,COMPLETE
985,0.04040276276171314,2025-09-08 16:58:24.654684,2025-09-08 16:58:24.825680,0 days 00:00:00.170996,0,0,0,0,0,True,True,7,3,2,n,COMPLETE
986,0.04040276276171314,2025-09-08 16:58:24.664681,2025-09-08 16:58:24.874679,0 days 00:00:00.209998,0,0,0,0,0,True,True,7,3,2,n,COMPLETE
987,0.04040276276171314,2025-09-08 16:58:24.695682,2025-09-08 16:58:24.885680,0 days 00:00:00.189998,0,0,0,0,0,True,True,7,3,2,n,COMPLETE
988,0.04040276276171314,2025-09-08 16:58:24.711684,2025-09-08 16:58:24.885680,0 days 00:00:00.173996,0,0,0,0,0,True,True,7,3,2,n,COMPLETE
989,0.04040276276171314,2025-09-08 16:58:24.742681,2025-09-08 16:58:24.934681,0 days 00:00:00.192000,0,0,0,0,0,True,True,7,3,2,n,COMPLETE
990,0.04040276276171314,2025-09-08 16:58:24.751682,2025-09-08 16:58:24.922680,0 days 00:00:00.170998,0,0,0,0,0,True,True,7,3,2,n,COMPLETE
991,0.04040276276171314,2025-09-08 16:58:24.766680,2025-09-08 16:58:24.941680,0 days 00:00:00.175000,0,0,0,0,0,True,True,7,3,2,n,COMPLETE
992,0.04040276276171314,2025-09-08 16:58:24.778682,2025-09-08 16:58:24.948682,0 days 00:00:00.170000,0,0,0,0,0,True,True,7,3,2,n,COMPLETE
993,0.04040276276171314,2025-09-08 16:58:24.787680,2025-09-08 16:58:24.944682,0 days 00:00:00.157002,0,0,0,0,0,True,True,7,3,2,n,COMPLETE
994,1.9952737481511622,2025-09-08 16:58:24.803681,2025-09-08 16:58:25.413681,0 days 00:00:00.610000,0,1,0,0,1,True,True,7,5,1,c,PRUNED
995,0.04040276276171314,2025-09-08 16:58:24.821680,2025-09-08 16:58:24.983680,0 days 00:00:00.162000,0,0,0,0,0,True,True,7,3,2,n,COMPLETE
996,0.041040701042565,2025-09-08 16:58:24.834680,2025-09-08 16:58:24.994680,0 days 00:00:00.160000,0,0,0,0,0,True,True,7,2,2,n,PRUNED
997,1.9963272457605734,2025-09-08 16:58:24.843682,2025-09-08 16:58:24.983680,0 days 00:00:00.139998,0,0,0,0,1,True,True,7,2,3,n,PRUNED
998,0.041040701042565,2025-09-08 16:58:24.863681,2025-09-08 16:58:25.006680,0 days 00:00:00.142999,0,0,0,0,0,True,True,7,2,2,n,PRUNED
999,0.04040276276171314,2025-09-08 16:58:24.887680,2025-09-08 16:58:25.048681,0 days 00:00:00.161001,0,0,0,0,0,True,True,7,3,2,n,COMPLETE
